{
  "schema_version": "0.1",
  "valid": true,
  "ir_version": "0.1",
  "program_id": "demo.analyze_numbers.v1",
  "semantic_hash": "sha256:1111111111111111111111111111111111111111111111111111111111111111",
  "validator": {
    "id": "org.ainative.aios-ir-validator",
    "version": "0.0.0-fixture",
    "build_hash": null
  },
  "registry_snapshot_id": "sha256:0000000000000000000000000000000000000000000000000000000000000000",
  "diagnostics": [],
  "validated_at": "2026-09-15T00:00:00Z"
}
